{
  "$schema": "../harmonizer.schema.json",
  "id": "{{instance}}harmonizer/default",
  "type": "harmonizer",
  "title": "Default Octothorpe Harmonizer",
  "mode": "html",
  "schema": {
    "subject": {
      "s": "source",
      "title": [
        {
          "selector": "title",
          "attribute": "textContent"
        }
      ],
      "description": [
        {
          "selector": "meta[name='description']",
          "attribute": "content"
        }
      ],
      "image": [
        {
          "selector": "meta[property='og:image']",
          "attribute": "content"
        },
        {
          "selector": "link[rel='octo:image']",
          "attribute": "href"
        },
        {
          "selector": "[data-octo-image]",
          "attribute": "href"
        },
        {
          "selector": "[data-octo-image]",
          "attribute": "src"
        }
      ],
      "contact": [
        {
          "selector": "meta[property='octo:contact']",
          "attribute": "content"
        }
      ],
      "type": [
        {
          "selector": "meta[property='octo:type']",
          "attribute": "content"
        }
      ],
      "postDate": [
        {
          "selector": "meta[property='article:published_time']",
          "attribute": "content"
        },
        {
          "selector": "time[datetime]",
          "attribute": "datetime"
        },
        {
          "selector": "meta[property='octo:postDate']",
          "attribute": "content"
        },
        {
          "selector": "[data-octodate]",
          "attribute": "data-octodate"
        }
      ],
      "indexPolicy": [
        {
          "selector": "meta[name='octo-policy']",
          "attribute": "content"
        },
        {
          "selector": "link[rel='octo:index']",
          "attribute": "href"
        },
        {
          "selector": "link[rel='preload'][href*='{{instance}}']",
          "attribute": "href"
        },
        {
          "selector": "img[src*='{{instance}}badge']",
          "attribute": "src"
        }
      ],
      "indexHarmonizer": [
        {
          "selector": "meta[name='octo-harmonizer']",
          "attribute": "content"
        },
        {
          "selector": "link[rel='octo:harmonizer']",
          "attribute": "href"
        }
      ],
      "robots": [
        {
          "selector": "meta[name='robots']",
          "attribute": "content"
        }
      ]
    },
    "hashtag": {
      "s": "source",
      "o": [
        {
          "selector": "octo-thorpe",
          "attribute": "textContent"
        },
        {
          "selector": "a[rel~='octo:octothorpes']",
          "attribute": "href",
          "postProcess": {
            "method": "regex",
            "params": "{{instance}}~/([^/]+)"
          }
        },
        {
          "selector": "link[rel='octo:octothorpes']",
          "attribute": "href"
        }
      ]
    },
    "link": {
      "s": "source",
      "o": [
        {
          "selector": "a[rel='octo:octothorpes']:not([href*='{{instance}}~/'])",
          "attribute": "href",
          "terms": {
            "attribute": "data-octothorpes"
          }
        }
      ]
    },
    "endorse": {
      "s": "source",
      "o": [
        {
          "selector": "[rel~='octo:endorses']:not([href*='{{instance}}~/'])",
          "attribute": "href",
          "terms": {
            "attribute": "data-octothorpes"
          }
        }
      ]
    },
    "bookmark": {
      "s": "source",
      "o": [
        {
          "selector": "[rel~='octo:bookmarks']:not([href*='{{instance}}~/'])",
          "attribute": "href",
          "terms": {
            "attribute": "data-octothorpes"
          }
        }
      ]
    },
    "cite": {
      "s": "source",
      "o": [
        {
          "selector": "[rel~='octo:cites']:not([href*='{{instance}}~/'])",
          "attribute": "href",
          "terms": {
            "attribute": "data-octothorpes"
          }
        }
      ]
    },
    "mention": {
      "s": "source",
      "o": [
        {
          "selector": "[rel~='octo:mentions']:not([href*='{{instance}}~/'])",
          "attribute": "href",
          "terms": {
            "attribute": "data-octothorpes"
          }
        }
      ]
    },
    "alias": {
      "s": "source",
      "o": [
        {
          "selector": "[rel~='octo:aliases']:not([href*='{{instance}}~/'])",
          "attribute": "href",
          "terms": {
            "attribute": "data-octothorpes"
          }
        },
        {
          "selector": "meta[property='octo:aliases']",
          "attribute": "content"
        }
      ]
    },
    "button": {
      "s": "source",
      "o": [
        {
          "selector": "[rel~='octo:button']",
          "attribute": "href",
          "terms": {
            "attribute": "data-octothorpes"
          }
        }
      ]
    },
    "documentRecord": {
      "richContent": [
        {
          "selector": "[data-octo-content='rich'], [data-octo-content='rich-content'], .octo-content",
          "attribute": "innerHTML",
          "postProcess": {
            "method": "sanitizeHtml",
            "params": {
              "maxLength": 100000
            }
          }
        }
      ]
    }
  }
}
