{
  "//": "Site-level demo harmonizer (#217 wave 5, #273). Discovered from api.harmonizers.dir. Its `mode` names the csv HANDLER, discovered separately from api.handlers.dir — this file is the proof that the two registries reference each other correctly. Same shape as a harmonizer fetched over HTTP. As of task 25 this definition is READ BY the handler: schema.subject IS the column-to-field map the csv handler applies. Editing this file changes what gets extracted with no code change in static/handlers/csv.js.",
  "id": "harmonizer/csv",
  "type": "harmonizer",
  "title": "CSV Column Harmonizer",
  "mode": "csv",
  "schema": {
    "subject": {
      "s": "source",
      "title": [{ "column": "title" }],
      "description": [{ "column": "description" }],
      "octothorpes": [{ "column": "octothorpes" }],
      "bookmarks": [{ "column": "bookmarks" }],
      "cites": [{ "column": "cites" }],
      "links": [{ "column": "links" }]
    }
  }
}
